{"status":"ok","module":"CarparkAvailability","snapshotAvailable":true,"dataAgeSeconds":37,"sourceTimestamp":"2026-10-22T17:42:36+08:00","carparkCount":2007,"mergedRecordCount":14,"inconsistentLotCount":5,"hasLocationData":true,"carparkInfoCount":2273,"highAvailabilityMinPct":50.0,"lowAvailabilityMaxPct":20.0,"staleAfterMinutes":15,"readingOutdatedMinutes":60,"cacheTtlSeconds":60,"minRefreshIntervalSeconds":15,"carparkInfoMaxAgeHours":24,"hdbCarparkInfoResourceId":"d_23f946fa557947f93a8043bbef41dd09"}
